{
 "$schema":"https://json-schema.org/draft/2020-12/schema","$id":"https://adp.dev/schema/delegation-request.schema.json","title":"DelegationRequest","type":"object","additionalProperties":false,"required":["specVersion","id","objective","authority"],
 "properties":{"specVersion":{"const":"0.1"},"id":{"type":"string","pattern":"^[A-Za-z0-9][A-Za-z0-9._:-]{0,127}$"},"parent":{"type":"object","additionalProperties":false,"required":["delegationId","depth"],"properties":{"delegationId":{"type":"string","minLength":1},"workerId":{"type":"string","minLength":1},"depth":{"type":"integer","minimum":1}}},"objective":{"type":"object","additionalProperties":false,"required":["summary"],"properties":{"summary":{"type":"string","minLength":1},"details":{"type":"string"}}},"context":{"type":"array","items":{"type":"object","additionalProperties":false,"required":["uri"],"properties":{"uri":{"type":"string","format":"uri-reference"},"mediaType":{"type":"string"},"digest":{"type":"string","pattern":"^sha256:[a-f0-9]{64}$"},"description":{"type":"string"}}}},"workspace":{"$ref":"workspace.schema.json"},"authority":{"$ref":"authority.schema.json"},"constraints":{"type":"object","additionalProperties":false,"properties":{"deadline":{"type":"string","format":"date-time"},"timeoutMs":{"type":"integer","minimum":1},"maxTurns":{"type":"integer","minimum":1},"maxContextTokens":{"type":"integer","minimum":1},"priority":{"enum":["low","normal","high"]}}},"budget":{"$ref":"#/$defs/budget"},"acceptanceCriteria":{"type":"array","items":{"$ref":"acceptance-criterion.schema.json"}},"expectedArtifacts":{"type":"array","items":{"$ref":"#/$defs/artifactSpec"}},"resultSchema":{"type":["object","boolean"]},"scheduling":{"$ref":"#/$defs/scheduling"},"metadata":{"type":"object","additionalProperties":{"type":"string"}}},
 "$defs":{"budget":{"type":"object","additionalProperties":false,"properties":{"currency":{"type":"string","pattern":"^[A-Z]{3}$"},"cost":{"type":"number","minimum":0},"inputTokens":{"type":"integer","minimum":0},"outputTokens":{"type":"integer","minimum":0},"totalTokens":{"type":"integer","minimum":0},"wallClockMs":{"type":"integer","minimum":0},"childDelegations":{"type":"integer","minimum":0}}},"artifactSpec":{"type":"object","additionalProperties":false,"required":["id","kind"],"properties":{"id":{"type":"string","minLength":1},"kind":{"enum":["file","patch","test_report","structured_data","report","log","blob"]},"mediaType":{"type":"string"},"path":{"type":"string"},"required":{"type":"boolean"},"schema":{"type":["object","boolean"]}}},"scheduling":{"type":"object","additionalProperties":false,"properties":{"requiredCapabilities":{"type":"array","items":{"type":"string"},"uniqueItems":true},"preferredCapabilities":{"type":"array","items":{"type":"string"},"uniqueItems":true},"trust":{"type":"array","items":{"type":"string"}},"locality":{"enum":["local","remote","hybrid","any"]},"workspaceModes":{"type":"array","items":{"enum":["shared","read_only","worktree","sandbox","remote"]}},"contextRequirements":{"type":"array","items":{"type":"string"}},"latencyClass":{"enum":["interactive","batch","flexible"]},"costCeiling":{"type":"number","minimum":0},"providerRestrictions":{"type":"array","items":{"type":"string"}},"modelRestrictions":{"type":"array","items":{"type":"string"}}}}}
}
