{"specVersion":"0.1","id":"rate-limit-42","objective":{"summary":"Implement an in-memory token-bucket rate limiter","details":"Change only src/rate-limit.ts and test/rate-limit.test.ts; preserve public APIs."},"workspace":{"id":"repo-9","uri":"file:///work/repo","baseRevision":"a82de1f","mode":"worktree","allowedRoots":[{"path":"src/rate-limit.ts","access":"read_write"},{"path":"test/rate-limit.test.ts","access":"read_write"},{"path":"package.json","access":"read"}]},"authority":{"capabilities":["shell","test"],"filesystem":{"read":["/work/repo"],"write":["/work/repo/src/rate-limit.ts","/work/repo/test/rate-limit.test.ts"]},"network":{"mode":"none"},"subprocess":{"allowed":true,"commands":["npm test"]},"credentials":[],"sideEffects":[],"delegation":{"allowed":false,"maxDepth":0}},"constraints":{"timeoutMs":600000,"maxTurns":20,"priority":"normal"},"budget":{"totalTokens":20000,"wallClockMs":600000,"childDelegations":0},"acceptanceCriteria":[{"id":"tests","kind":"command","description":"npm test passes","evaluator":"caller","command":"npm test"},{"id":"burst","kind":"assertion","description":"Burst and refill behavior are tested","evaluator":"caller","property":"test suite covers burst and refill"}],"expectedArtifacts":[{"id":"changes","kind":"patch","mediaType":"text/x-diff","required":true},{"id":"test-report","kind":"test_report","mediaType":"application/json","required":true}],"resultSchema":{"type":"object","required":["changedFiles"],"properties":{"changedFiles":{"type":"array","items":{"type":"string"}}}},"metadata":{"example":"coding-task"}}
