{"specVersion":"0.1","id":"architecture-review-7","objective":{"summary":"Identify module boundaries and circular dependencies","details":"Return findings with file citations; make no changes."},"workspace":{"id":"repo-9","uri":"file:///work/repo","baseRevision":"a82de1f","mode":"read_only","allowedRoots":[{"path":".","access":"read"}]},"authority":{"capabilities":["repository.inspect"],"filesystem":{"read":["/work/repo"],"write":[]},"network":{"mode":"none"},"subprocess":{"allowed":false},"credentials":[],"sideEffects":[],"delegation":{"allowed":false,"maxDepth":0}},"acceptanceCriteria":[{"id":"report","kind":"artifact","description":"A cited architecture report is returned","artifactSpecId":"architecture-report","evaluator":"caller"}],"expectedArtifacts":[{"id":"architecture-report","kind":"report","mediaType":"text/markdown","required":true}]}
