{"specVersion":"0.1","id":"rate-limit-tests-child","parent":{"delegationId":"rate-limit-42","workerId":"coding-worker","depth":1},"objective":{"summary":"Write edge-case tests for the existing rate limiter implementation"},"workspace":{"id":"repo-9-child","uri":"file:///work/repo","baseRevision":"a82de1f","mode":"worktree","allowedRoots":[{"path":"test/rate-limit.test.ts","access":"read_write"},{"path":"src/rate-limit.ts","access":"read"}]},"authority":{"capabilities":["test"],"filesystem":{"read":["/work/repo/src/rate-limit.ts","/work/repo/test/rate-limit.test.ts"],"write":["/work/repo/test/rate-limit.test.ts"]},"network":{"mode":"none"},"subprocess":{"allowed":true,"commands":["npm test"]},"credentials":[],"sideEffects":[],"delegation":{"allowed":false,"maxDepth":0}},"budget":{"totalTokens":5000,"wallClockMs":180000,"childDelegations":0},"acceptanceCriteria":[{"id":"tests","kind":"command","description":"npm test passes","command":"npm test","evaluator":"worker"}],"expectedArtifacts":[{"id":"test-patch","kind":"patch","mediaType":"text/x-diff","required":true}]}
